{
  "$schema": "../../schemas/audio-calibration.schema.json",
  "schemaVersion": 1,
  "projectSlug": "vox-depth-stack-pilot-submarine-cinematic",
  "status": "not-required",
  "sourceFingerprint": "02a6e811d349566f080208dc72a28ec8343fddd320f30e24f9a13d6ee1715e19",
  "currentNarrationVolume": 4,
  "recommendedNarrationVolume": 4,
  "generatedAt": "2026-07-23T20:10:34.061Z",
  "acceptedAt": "2026-07-23T20:10:34.061Z",
  "acceptanceNote": "当前预检已经通过，无需调节。",
  "previousAcceptance": null,
  "preflight": {
    "passed": true,
    "mastering": {
      "targetLufs": -16,
      "toleranceLufs": 3,
      "truePeakDbtp": -1
    },
    "loudness": {
      "integratedLufs": -18.79,
      "truePeakDbtp": -6.03,
      "loudnessRangeLu": 1.7
    },
    "loudnessPassed": true,
    "truePeakPassed": true,
    "currentNarrationVolume": 4,
    "recommendedNarrationVolume": 4,
    "recommendationIsApproximate": true,
    "mix": {
      "file": "dist/vox-depth-stack-pilot-submarine-cinematic/audio-preflight.wav",
      "durationSeconds": 18,
      "eventCount": 1,
      "events": [
        {
          "kind": "narration",
          "id": "narration:submarine-scene",
          "sceneId": "submarine-scene",
          "src": "projects/vox-depth-stack-pilot-submarine-cinematic/audio/submarine-music-cinematic.wav",
          "startSeconds": 0,
          "volume": 4
        }
      ]
    }
  }
}
